{
    "title": "Example title for metadata example - Version 1.3.0",
    "description": "example metadata for example data",
    "language": [
        "eng",
        "ger",
        "fre"
    ],
    "spatial": {
        "location": "none",
        "extent": "europe",
        "resolution": "100 m"
    },
    "temporal": {
        "reference_date": "2016-01-01",
        "start": "2017-01-01",
        "end": "2017-12-31",
        "resolution": "hour"
    },
    "sources": [
        {
            "name": "OpenEnergyPlatform Metadata Example",
            "description": "Metadata description",
            "url": "https://github.com/OpenEnergyPlatform",
            "license": "Creative Commons Zero v1.0 Universal (CC0-1.0)",
            "copyright": "© Reiner Lemoine Institut"
        },
        {
            "name": "OpenStreetMap",
            "description": "A collaborative project to create a free editable map of the world",
            "url": "https://www.openstreetmap.org/",
            "license": "ODbL-1.0",
            "copyright": "© OpenStreetMap contributors"
        }
    ],
    "license": {
        "id": "ODbL-1.0",
        "name": "Open Data Commons Open Database License 1.0",
        "version": "1.0",
        "url": "https://opendatacommons.org/licenses/odbl/1.0/",
        "instruction": "You are free: To Share, To Create, To Adapt; As long as you: Attribute, Share-Alike, Keep open!",
        "copyright": "© Reiner Lemoine Institut"
    },
    "contributors": [
        {
            "name": "Ludee",
            "email": "none",
            "date": "2016-06-16",
            "comment": "Create metadata"
        },
        {
            "name": "Ludee",
            "email": "none",
            "date": "2016-11-22",
            "comment": "Update metadata"
        },
        {
            "name": "Ludee",
            "email": "none",
            "date": "2016-11-22",
            "comment": "Update header and license"
        },
        {
            "name": "Ludee",
            "email": "none",
            "date": "2017-03-16",
            "comment": "Add license to source"
        },
        {
            "name": "Ludee",
            "email": "none",
            "date": "2017-03-28",
            "comment": "Add copyright to source and license"
        },
        {
            "name": "Ludee",
            "email": "none",
            "date": "2017-05-30",
            "comment": "Update metadata to version 1.3"
        },
        {
            "name": "Ludee",
            "email": "none",
            "date": "2017-06-26",
            "comment": "Update metadata version 1.3: move reference_date into temporal and remove some array"
        }
    ],
    "resources": [
        {
            "name": "model_draft.oep_metadata_table_example_v13",
            "format": "PostgreSQL",
            "fields": [
                {
                    "name": "id",
                    "description": "Unique identifier",
                    "unit": "none"
                },
                {
                    "name": "year",
                    "description": "Reference year",
                    "unit": "none"
                },
                {
                    "name": "value",
                    "description": "Example value",
                    "unit": "MW"
                },
                {
                    "name": "geom",
                    "description": "Geometry",
                    "unit": "none"
                }
            ]
        }
    ],
    "metadata_version": "1.3"
}